###ÄNSI;;;;;;;;;;;;x
EVTDESC_LT_20060_fake_book;Many scholars accepted my invitation and gathered for several days discussing not only the book by [Root.GetAuthorName], but also other ancient knowledge. Unfortunately, after much discussion, the book was considered as a forgery, but my court is famous now as a center for scholarly debate, culture and knowledge.;De nombreux érudits ont accepté mon invitation et se sont réunis pendant plusieurs jours pour discuter non seulement du livre de [Root.GetAuthorName], mais aussi d'autres connaissances anciennes. Malheureusement, après de nombreuses discussions, le livre est considéré comme un faux. Néanmoins, ma cour est désormais réputée pour son centre de débats, de culture et de savoir.;Viele Gelehrte nahmen meine Einladung an und versammelten sich mehrere Tage lang, um nicht nur das Buch von [Root.GetAuthorName] zu diskutieren, sondern auch andere alte Werke. Leider wurde das Buch nach langer Diskussion als Fälschung bestätigt, aber trotzdem ist mein Hofe heute als Zentrum für wissenschaftliche Debatten, Kultur und Wissen bekannt.;;Muchos eruditos aceptaron la invitación y se reunieron durante muchos días no solo para discutir el libro de [Root.GetAuthorName], sino también otros conocimientos antiguos. Por desgracia, se consideró que el libro era una falsificación, pero ahora mi corte es famosa como centro de cultura, debate erudito y conocimientos.;;;;;;;;x
EVTOPTA_LT_20060_real_book;A center for culture. That sounds good.;Un centre de culture. Cela semble bien.;Ein Kulturzentrum!? Das Klingt gut.;;Un centro de cultura. Suena bien.;;;;;;;;x
EVTOPTA_LT_20060_fake_book;Good. And maybe next time I will actually obtain a masterpiece.;Bien. Et peut-être que la prochaine fois, j'obtiendrai vraiment un chef-d'œuvre.;Gut.Vielleicht bekomme ich beim nächsten Mal tatsächlich ein Meisterwerk.;;Bien. Puede que la próxima vez consiga una obra maestra de verdad.;;;;;;;;x
CHRONICLE_FOUND_REAL_BOOK;A book containing the lost [Root.GetBookTheme] by the famous [Root.GetAuthorTitle] [Root.GetAuthorName] was acquired and on this date a great meeting of scholars confirmed its authenticity. In those times, [wonder_province.GetName] was known as a place of culture, visited by scholars from afar. ;Un livre contenant le [Root.GetBookTheme] perdu du célèbre [Root.GetAuthorTitle] [Root.GetAuthorName] a été acquis et un grand rassemblement d'érudits a confirmé son authenticité. À cette époque, nous considérions [wonder_province.GetName] comme un lieu de culture où se rendaient des érudits venus de loin.;Ein verloren geglaubtes [Root.GetBookTheme] des/der berühmten en [Root.GetAuthorTitle] [Root.GetAuthorName] wurde heute von einer großen Delegation an Gelehrten als echt anerkannt. [wonder_province.GetName] ist nun als Kulturort bekannt, der von Gelehrten aus aller Ferne besucht wird.;;Se consiguió un libro que contenía el [Root.GetBookTheme] perdido del célebre [Root.GetAuthorTitle] [Root.GetAuthorName] y hoy los eruditos han confirmado su autenticidad. En esa época se conocía a [wonder_province.GetName] como un centro de cultura, visitado por eruditos que venían desde lejos.;;;;;;;;x
monk;Adept;Adept;Adept;;Adept;;;;;;;;x
EVTDESC94107;Much knowledge has been lost since the glory days of the Netherese Empire, but some of their engineering knowledge has been preserved in dusty, old tomes for posterity. You have spent several days studying a few of these, and your learning has improved.;;;;;;;;;;x
EVTDESC94018;History is a subject that has always fascinated you, and you have spent the last few tendays studying the campaigns of Gilgeam the Great. There are many lessons to be learned from his conquests in the east.;;;;;;;;;;x
EVTDESC_TOG_3402;As you are out hunting one afternoon, a bearded elder approaches, donning a simple traveler's cloak and a wide brimmed hat. He greets you with courtesy, requests a horn of mead, and then informs you that just yonder, a well lies forgotten, filled with gold. He wanders off, leaving you struck with the familiarity of his presence.;;;;;;;;;;x
EVTOPTA_TOG_3402;You inform your men that the wanderer was none other than [Root.Religion.GetHighGodName].;;;;;;;;;;x
odin_option_a;You urge your horse forth to seek the God's treasure with your fellow hunters in pursuit.;Vous partez à cheval à la recherche du trésor divin, avec vos compagnons chasseurs qui vous talonnent.;Ihr treibt Euer Pferd vorwärts, dem Schatz des Gottes entgegen, gefolgt von Euren treuen Jagdbegleitern.;;Montas tu caballo para buscar el tesoro del Dios liderando tu fiel equipo de cazadores.;;;;;;;;;x
EVTOPTB_TOG_3402;You ignore your mens' insistence that the stranger was [Root.Religion.GetHighGodName].;;;;;;;;;;x
odin_option_b;You carry on with your hunt.;Vous poursuivez la chasse.;Ihr setzt Eure Jagd fort.;;Continuas con la caza.;;;;;;;;;x
EVTOPTC_TOG_3402;You laugh at the notion that gods would care about mortals.;;;;;;;;;;x
odin_option_c;Afterall, what have they done for you?;Après tout, qu'ont-ils fait pour vous ?;Was haben sie schließlich schon für euch getan?;;Después de todo, ¿Qué han hecho por ti?;;;;;;;;;x
EVTDESC_SoA_561;The realm has benefitted from the vast network of contacts that [From.GetTitledName], your Gur [Root.GetMyChancellorName], has fostered abroad. Somehow [From.GetSheHe] always manages to keep up to date on new customs and the latest diplomatic developments.;;;;;;;;;x
EVTDESC_SoA_563;[From.GetTitledName], your [Root.GetMyTreasurerName], has several contacts among the Gur merchants, whose network supposedly stretches across the entirety of Faerûn, from the Sword Coast all the way to distant Shou Lung, and these contacts have been a great boon to the development of the realm's economy.;;;;;;;;;x
EVTDESC_SoA_565;Your [Root.GetMySpymasterName], [From.GetTitledName], seems to have friends and informants inside every Gur community in Faerûn. Messenger pigeons arrive at [From.GetHerHis] abode on a daily basis, often carrying vital intelligence from abroad about new weapons and tactics.;;;;;;;;;;x
EVTDESC94098;You have come into possession of a copy of the prophecies of Alaundo the Seer. Studying this historical work could provide insights that improve your learning.;;;;;;;;;;x
EVTDESC94099;At last, you have finished your studies of the prophecies of Alaundo. It took many nights of reading with only the light of a candle to keep you company, but you do not regret a second of it. Your learning has improved.;;;;;;;;;;x
EVTOPTB69060;Expose the courtier as not devout enough;;;;;;;;;;x
BLOODLINE_EASIER_VOWS_TOOLTIP;Both [From.GetFirstName] and [Root.GetFirstName] are relatives and belong to a §YBloodline§! with monastic traditions!;;;;;;;;;x
logistics_expert;Logistics Expert;;;;;;;;;x
master_of_flame;Master of Assault;;;;;;;;;x
sapper;Sapper;;;;;;;;;x
levy_coordinator;Coordinator;;;;;;;;;x
chinese_imperial_government;Celestial Empire;;;;;;;;;x
chinese_imperial_government_desc;Shou Imperialism, much like the ordinary Feudal government, revolves around vassals owing fealty to their liege. It is directed by Lao Chin-Mao's 'Book of Heaven', and promotes peaceful dialog over religious differences.;;;;;;;;;x
action_organize_raid_desc;Have your [GetMarshalName] gather men for a great raid, for plunder and glory! If you don't use these troops for raiding (and raiding isn't turned off in the Game Rules), they will get angry at you and take your gold instead.;Demander à votre [GetMarshalName] d'organiser un grand pillage. Butin et gloire sont au menu ! Si vous n'utilisez pas ces troupes pour vos pillages, elles perdront le moral et s'attaqueront à vous et à votre or.;Beauftragt Euren [GetMarshalName], Männer für einen großen Raubzug zu sammeln. Für Beute und Ruhm! Wenn Ihr diese Truppen nicht bei Raubzügen einsetzt, werden sie wütend auf Euch sein und Euer Gold stehlen.;;¡Que tu [GetMarshalName] reclute hombres para una gran incursión en busca de botín y gloria! Si no usas estas tropas una incursión, se enfadarán contigo y en su lugar se llevarán tu oro.;;;;;;;;;x
RULE_DYNASTY_TITLE_NAMES_ON_DESC;Many cultures name their titles after the ruling dynasty.;De nombreuses cultures nomment leurs titres selon la dynastie régnante.;Viele Kulturen benennen ihre Titel nach den herrschenden Dynastien.;;Muchas culturas dan nombre a sus títulos de acuerdo con la dinastía que las gobierne.;;;;;x
RULE_CULTURAL_TITLE_NAMES_ON_DESC;The names of titles may change depending on the ruling culture.;Les noms des titres peuvent changer en fonction de la culture du dirigeant.;Je nach Herrscherkultur kann sich die Titelbezeichnung ändern.;;"Los nombres de los títulos pueden cambiar dependiendo de la cultura predominante.";;;;;x
child_of_mithridates;Green Dragon Blood;;;;;;;;;;;;;x
child_of_mithridates_desc;This character resists poison to such a degree that people believe [GetSheHe] must be descended from a great green dragon.;;;;;;;;;;;;;x
EVTOPTV_TOG_501;My strong bonds to [GetPatronHighGodName].;Mes liens solides avec [GetPatronHighGodName].;Meine starken Bindungen zu [GetPatronHighGodName].;;Mis fuertes lazos con [GetPatronHighGodName].;;;;;;;;;x
EVTDESC94018_india;History is a subject that has always fascinated you, and you have spent the last few tendays studying the campaigns of Reinhar I of Dambrath. There are many lessons to be learned from his conquests.;L'histoire est un domaine qui vous a toujours fasciné, et vous avez passé les dernières semaines à étudier les campagnes d'Ashoka le Grand. Ses conquêtes sont riches de nombreux enseignements.;Schon immer war die Geschichte ein Fach, dem Euer besonderes Interesse galt, und so habt Ihr Euch in den letzten Wochen eingehend mit den Feldzügen Ashokas des Großen befasst. Das Studium seiner Eroberungen war höchst aufschlussreich.;;Siempre te ha fascinado la historia, y en las últimas semanas has pasado muchos ratos estudiando las campañas de Ashoka el Grande. Se puede aprender mucho de sus conquistas.;;;;;;;;;x
EVTDESC_94019;After many months studying the campaigns of Gilgeam the Great you have acquired many fascinating insights and gained new wisdom in military matters. You realize that the Art of War might be well worth studying.;Après des mois passés à étudier les campagnes d'Alexandre le Grand, vous avez acquis de nombreuses et fascinantes connaissances, ainsi qu'une nouvelle vision de la chose militaire. Vous pensez qu'il pourrait être bon de vous plonger dans l'étude de l'art de la guerre.;Nach mehreren Monaten des Studiums der Feldzüge Alexanders des Großen, durch das Ihr viele neue Erkenntnisse gewinnen konntet, hat sich Euer Verständnis für militärische Belange deutlich verbessert. Ihr erkennt, dass sich das Studium der Kriegskunst durchaus lohnen könnte.;;Después de muchos meses estudiando las campañas de Alejandro Magno, has aprendido muchas cosas sobre asuntos militares. Te parece que el Arte de la Guerra merece la pena estudiarla bien.;;;;;;;;;x
EVTDESC_94019_india;After spending many months studying the campaigns of Reinhar I of Dambrath you have gained some fascinating insights and acquired new wisdom in military matters. You realize that the Art of War might be well worth studying.;Après des mois passés à étudier les campagnes d'Ashoka le Grand, vous avez acquis de nombreuses et fascinantes connaissances, ainsi qu'une nouvelle vision de la chose militaire. Vous pensez qu'il pourrait être bon de vous plonger dans l'étude de l'art de la guerre.;Nach mehreren Monaten des Studiums der Feldzüge Ashokas des Großen, durch das Ihr viele neue Erkenntnisse gewinnen konntet, hat sich Euer Verständnis für militärische Belange deutlich verbessert. Ihr erkennt, dass sich das Studium der Kriegskunst durchaus lohnen könnte.;;Después de muchos meses estudiando las campañas de Ashoka el Grande, has aprendido muchas cosas sobre asuntos militares. Te parece que el Arte de la Guerra merece la pena estudiarla bien.;;;;;;;;;x
tp_school_1_desc;This school teaches many subjects and is a rare center of high learning, but the students enrolled here primarily study to prepare themselves for future careers in the clergy.;De nombreuses disciplines sont enseignées dans cette école et c'est l'un des rares lieux d'enseignement. Toutefois, les élèves qui y sont admis se préparent principalement à une carrière religieuse.;Diese Schule unterrichtet viele Fächer und ist ein seltenes Zentrum der höheren Lehre, doch die Schüler, die hier eingeschrieben sind, studieren hier hauptsächlich, um sich auf ihre zukünftigen Karrieren im Klerus vorzubereiten.;;Esta escuela imparte numerosas materias y es un centro poco habitual para la formación superior, aunque la mayoría de los estudiantes matriculados en ella se preparan para su futura carrera en el clero.;;;;;;;;;x
String_ES_FALLBACK_GetTrueReligionScriptureNameDelDela;del [This.GetTrueReligionScriptureName];;;;;;;;;x
EVTOPTA94106;"...with no rulers but the dead. Dragons shall rule the world...";Semper ubi sub ubi ubique.;Semper ubi sub ubi ubique.;;Semper ubi sub ubi ubique.;;;;;;;;;x
EVTDESC_REP_151;Word has reached you that your mortal enemies, the [From.GetOnlyDynastyName] family, are planning the construction of a great galley the likes of which has never before been seen. It is to surpass even the Merry Marid, personal barge of the Syl-Pasha of Calimshan, in size and splendor. The hubris of [From.GetTitledFirstName] is without equal!\n\n[Root.job_spymaster.GetTitledFirstName], your [Root.GetSpymasterName], has put together a plan to make sure this atrocity never sails the seas. Men loyal to [Root.job_spymaster.GetHerHim] will infiltrate the [From.GetOnlyDynastyName] shipyard in [Root.MercRepCapital.GetName] posing as shipwrights. Once inside, they will add several subtle structural flaws to the galley that will hopefully escape detection until it sets out on its maiden voyage...;Vous entendez dire que vos ennemis jurés, les [From.GetOnlyDynastyName], projettent la construction du plus grand navire que le monde n'ait jamais vu. Il devrait même surpasser en taille et en splendeur le Bucentaure, ce somptueux navire-amiral du Doge de Venise. La démesure [From.Get_du_TitledFirstName] est sans égale ! \n\n[Root.job_spymaster.GetTitledFirstName], votre [Root.GetSpymasterName], a ourdi un plan pour assurer que cette atrocité ne puisse jamais voguer sur les mers. Des hommes qui lui sont loyaux vont se faire passer pour des charpentiers et infiltrer le chantier naval de [From.GetOnlyDynastyName] à [Root.MercRepCapital.GetName]. Lorsqu'ils seront sur place, ils intégreront quelques subtils défauts à la structure de le navire. Ceux-ci ne seront sans doute pas détectés avant que le navire entreprenne son long voyage...;Euch ist zu Ohren gekommen, dass Euer Todfeind, die [From.GetOnlyDynastyName]-Familie, den Bau einer großen Galeere plant, von einem Ausmaß, das es nie zuvor gegeben hat. Es soll in Größe und Herrlichkeit sogar die Bucentaur überflügeln, das Flaggschiff des venezianischen Dogen. Die Selbstüberschätzung von [From.GetTitledFirstName] kennt keine Grenzen!\n\n[Root.job_spymaster.GetTitledFirstName], Euer [Root.GetSpymasterName], hat sich einen Plan ausgedacht, der dafür sorgen wird, dass diese Grässlichkeit niemals auf den Meeren segeln wird. Männer, die [Root.job_spymaster.Getihmihr] gegenüber loyal sind, werden die [From.GetOnlyDynastyName]-Werft in [Root.MercRepCapital.GetName] infiltrieren, indem sie sich als Schiffsbauer ausgeben. Sobald sie im Innern sind, werden sie viele bauliche Mängel an der Galeere vornehmen, die hoffentlich nicht entdeckt werden, bis sie zu ihrer Jungfernfahrt ausläuft ...;;Te han llegado rumores de que tus mortales enemigos, la familia [From.GetOnlyDynastyName], planea construir una gran galera de dimensiones nunca vistas. Sobrepasará en tamaño y esplendor incluso al bucintoro, el buque insignia del dux de Venecia. ¡La arrogancia de [From.GetTitledFirstName] no tiene parangón!\n\n[Root.job_spymaster.GetTitledFirstName], tu [Root.GetSpymasterName], ha elaborado un plan para asegurarse de que esta atrocidad no surque jamás los mares. Sus leales hombres se infiltrarán en el astillero de [From.GetOnlyDynastyName] en [Root.MercRepCapital.GetName] haciéndose pasar por carpinteros de ribera. Una vez en su interior, provocarán sutiles defectos estructurales en la galera que con suerte pasarán desapercibidos hasta que el buque realice su viaje inaugural...;;;;;;;;;x
EVTOPTA76000a;Sure, let's do it.;;;;;;;;;;;x
EVTOPTB76000a;I think I'll pass.;;;;;;;;;;;x
evt_400_desc_a;I am surely with child... my husband will be pleased.;Je crois que j'attends un enfant... Mon mari va être ravi.;Ich bin definitiv schwanger ... Mein Gatte wird erfreut sein.;;Seguramente estoy encinta... Mi esposo estará complacido.;;;;;;;;;x
evt_CK2_400_desc_b;I am surely with child... I wonder what my late husband would think of this.;Je suis sûrement enceinte... Je me demande ce que mon défunt mari en penserait.;Ich bin schwanger... Ich frage mich, was mein verstorbener Mann darüber denken würde.;;Estoy embarazada… me pregunto qué pensaría mi difunto marido.;;;;;;;;;x
evt_CK2_400_desc_c;I am surely with child... my consort will be pleased.;Je suis sûrement enceinte... mon concubin va être content.;Ich bin schwanger... mein Konkubinator wird sich freuen.;;Creo que estoy embarazada… seguro que mi concubino está encantado.;;;;;;;;;x
evt_CK2_400_DESC_D;I am surely with child. I wonder which one of my consorts is the lucky father...;Je suis sûrement enceinte. Je me demande lequel de mes concubins est l'heureux père...;Ich bin schwanger... welcher meiner Konkubinatoren wohl der Vater ist!?;;Creo que estoy embarazada. No sé cuál de mis concubinos será el afortunado padre…;;;;;;;;;x
evt_304_desc_a;[FromFrom.Mother.GetFirstName] has borne the child of another man! I cannot believe this betrayal!;[FromFrom.Mother.GetFirstName] a donné naissance à un enfant d'un autre homme ! Je ne peux croire à cette trahison !;[FromFrom.Mother.GetFirstName] hat das Kind eines anderen Mannes geboren! Ich kann diesen Verrat nicht fassen!;;[FromFrom.Mother.GetFirstName] ha dado a luz al bebé de otro hombre! No puedo creer esta traición!;;;;;;;;;x
evt_CK2_304_desc_b;The fruit of [FromFrom.Mother.GetFirstName]'s shameful infidelity has finally been born. I still cannot believe [FromFrom.Mother.GetSheHe] would betray me so brazenly.;Le fruit de l'infidélité honteuse de [FromFrom.Mother.GetFirstName] est finalement venu au monde. Je n'arrive toujours pas à croire qu'elle ait pu me trahir de manière aussi effrontée.;Die Früchte der schändlichen Untreue von [FromFrom.Mother.GetFirstName] sind endlich geboren. Ich kann noch immer nicht fassen, wie [FromFrom.Mother.GetSheHe] mich so sehr verraten konnte.;;Por fin ha nacido el fruto de la vergonzosa infidelidad de [FromFrom.Mother.GetFirstName]. No me puedo creer que me traicionara tan descaradamente.;;;;;;;;;x
EVTOPTA_LT_20520;Praise [target_dead_ruler.GetPatronHighGodName]!;Que le Seigneur soit loué !;Lang leben die Fürsten!;;¡Alabemos al Señor!;;;;;;;;;x