###ÄNSI;;;;;;;;;;;;x
EVTDESC402a;It seems I am with child, though not by my husband. Fortunately we give little mind to such matters.;;;;;;;;;;;x
EVTDESC412a;It seems I am with child, though the child is not my lord's. Fortunately we concern ourselves little with these things.;;;;;;;;;;;x
EVTOPTA455;What a waste of time!;;;;;;;;;;;x
EVTOPTB450;Avoid [From.GetHerHim];;;;;;;;;;;x
EVTDESC401a;It seems I am pregnant. Fortunately, we do not care about it being out of wedlock as some others might.;;;;;;;;;;;x
EVTOPTA402a;Good thing I don't have to lie about it.;;;;;;;;;;;x
EVTTOOLTIP404a;Your spouse is informed.;;;;;;;;;;;x
GENMISC.27_CASE1;Your spouse, [From.GetBestName] has informed you she is pregnant from [From.FatherOfUnborn.GetBestName].;;;;;;;;;;;x
GENMISC.27_CASE2;Your spouse, [From.GetBestName] has informed you she is pregnant from one of her fleeting lovers.;;;;;;;;;;;x
GENMISC.27a;Thanks for telling me.;;;;;;;;;;;x
dwarf;Short;;;;;;;;;;;x
dwarf_desc;This unfortunate character was born very small.;;;;;;;;;;;x
giant;Tall;;;;;;;;;;;x
giant_desc;This character was born very tall. While imposing, this character suffers from significant health problems and is likely to die young.;;;;;;;;;;;
military_jesus;[Root.Religion.GetRandomGodName] Gives Military Advice;;;;;;;;;;;x
military_jesus_desc;This character seems to be blessed with the military advice of the divine.;;;;;;;;;;;x
voice_of_jesus;Voice of [Root.Religion.GetRandomGodName];;;;;;;;;;;x
voice_of_jesus_desc;Apparently the divine speaks to this character.;;;;;;;;;;;x
voice_of_satan;Voice of [Root.Religion.GetRandomEvilGodName];;;;;;;;;;;x
voice_of_satan_desc;Apparently the enemies of the faith speak to this character.;;;;;;;;;;;x
EVTOPTA1980;I like how this feels;;;;;;;;;;;x
EVTDESC1980;I find myself being drawn to others in new and exciting ways;;;;;;;;;;;x
EVTDESC1990;I find myself being drawn to others in new and exciting ways;;;;;;;;;;;x
EVTOPTALoR.886;Tell us more about this mythical realm of Malatra.;Dites-m'en plus sur ce royaume mythique d'Hindoustan.;Erzählt uns mehr über dieses mysteriöse Reich der Hindus.;;Cuéntanos más acerca de este mítico reino de Indostán.;;;;;;;x
true_christian_knight;Champion of the Estelar;;;;;;;;;;;x
true_christian_knight_desc;Bravery and no mortal sins gives a true heroic knight respect from the clergy.;;;;;;;x
DIPLOFLAVOR_INSULT_0;Tales of your misdeeds are told from Moonshae to Wa.;Vos méfaits sont connus depuis l'Irlande jusqu'à Shou Lung.;von Euren Missetaten erzählt man sich von Irland bis China!;;Se cuentan historias de tus fechorías desde Irlanda hasta Catay.;;;;;;;x
DIPLOFLAVOR_INSULT_1;Your low character is the subject of Chessentan plays.;Votre bassesse est telle qu'elle a inspiré des pièces de théâtre grecques ! ;Euer niederer Charakter ist Mittelpunkt griechischer Theaterstücke!;;Tu escaso carácter es el tema de las obras de teatro griegas.;;;;;;;x
DIPLOFLAVOR_INSULT_muslim_2;May Fate ruin your house.;Qu'Allah détruise votre Maison ! ;möge Allah Euer Haus vernichten!;;Que Alá destruya tu casa.;;;;;;;x
HF_222_DESC;My servants apparently lost track of [child_of_destiny.GetFirstName] today, and it took hours to locate [child_of_destiny.GetHerHim]! [child_of_destiny.GetSheHeCap] was found in the nick of time, just before I was about to order a full-scale search. When they found [child_of_destiny.GetHerHim] [child_of_destiny.GetSheHe] was reading a book no one had ever seen before, written in lorass no less...;Mes serviteurs ont apparemment perdu la trace de [child_of_destiny.GetFirstName] aujourd'hui et cela a pris des heures pour [child_of_destiny.GetLeLa] retrouver, juste à temps avant que j'ordonne une recherche à grande échelle. [child_of_destiny.GetIlElleCap] lisait un livre que personne n'avait jamais vu auparavant, écrit en latin.;Meine Diener haben heute scheinbar [child_of_destiny.GetFirstName] verloren und es hat Stunden gedauert [child_of_destiny.Getihnsie] ausfindig zu machen! [child_of_destiny.GetSheHeCap] wurde gerade rechtzeitig gefunden, kurz bevor ich eine umfassende Suche anordnen wollte. Als sie [child_of_destiny.Getihnsie] fanden, las [child_of_destiny.GetSheHe] ein Buch, das zuvor noch niemand gesehen hat, geschrieben in Latein...;;¡Al parecer, hoy mis sirvientes perdieron la pista de [child_of_destiny.GetFirstName] y les llevó horas localizarlo! Solo lo hallaron en el último instante, cuando estaba a punto de organizar una batida general. Al encontrarlo, estaba leyendo un libro que nadie había visto, y encima en latín…;;;;;;;x
HF_222_OPTA;[child_of_destiny.GetFirstName], oh how you scared me...! And how do you know Loross?;[child_of_destiny.GetFirstName], vous m'avez fait très peur ! ... Et comment connaissez-vous le latin ?;[child_of_destiny.GetFirstName], ich habe mir solche Sorgen gemacht! Und woher kannst du Latein?;;¡Qué susto me has dado, [child_of_destiny.GetFirstName]! ¿Desde cuándo sabes latín?;;;;;;;x
EVTDESC_TOG_3306;The key fits the lock, and trembling with anticipation you slowly open the chest. It is filled with ancient gold coins, carved with the likeness of the long-dead Emperors of Netheril and words written in their strange language!;La clef entre dans la serrure et, tremblant d'excitation, vous ouvrez lentement le coffre. Il est rempli d'anciennes piËces d'or gravÈes d'un seau similaire ‡ celui des empereurs romains morts depuis des lustres et de mots Ècrits dans leur langue Ètrange†!;Der Schl¸ssel passt perfekt ins Schloss und zitternd vor Erwartung ˆffnet Ihr langsam die Truhe. Sie ist mit uralten Goldm¸nzen gef¸llt, die das Antlitz l‰ngst verstorbener, rˆmischer Imperatoren eingepr‰gt haben sowie Worte in ihrer fremden Sprache.;;La llave encaja en la cerradura, y temblando de emociÛn abres el cofre poco a poco. °Est· lleno de antiguas monedas de oro, talladas con la imagen de los Emperadores de Roma muertos hace mucho tiempo y palabras escritas en su extraÒo idioma!;;;;;;;x
EVTDESC_TOG_3300;As your men return from looting the holding, one of them hands you an unlocked chest with a faint arcane aura. Whatever is inside, must be magical.;;;;;;;;;;;x
EVTOPTA_TOG_3300;I can't wait to see what's inside!;;;;;;;;;;;x
EVTOPTB_TOG_3300;No, leave it.;;;;;;;;;;;x
EVTDESC_TOG_3307;As you finally unlock the chest, an arcane aura fills the air. Whatever is inside, must be magical.;;;;;;;;;;;x
EVTOPTA_TOG_3307;I can't wait to see what it is!;;;;;;;;;;;x
EVTDESC_TOG_3309;As you finally unlock the chest, you feel a shiver down your spine. Suddenly, the chest opens on its own, springing into action and sporting rows of sharp teeth!;;;;;;;;;;;x
EVTOPTA_TOG_3309;Have at thee, creature!;;;;;;;;;;;x
EVTOPTB_TOG_3309;Aaaagh! Mimic!;;;;;;;;;;;x
terrible_armor;Mundane Armor;;;;;;;;;;;x
EVTOPTA_WOL_99;I'm more skilled than a succubus!;;;;;;;;;x
EVTOPTA_WOL_99_PERS;I'm more skilled than a succubus!;;;;;;;;;x
EVTDESC_TOG_604;The guests have arrived, and the time has come for the blot to begin! You gather outside the temple, and start by offering animals as sacrifice to the gods. While their meat is prepared for the feast that is to follow, the blood is sprinkled on altars of the gods, as well as on the worshipers themselves.;;;;;;;;;;;x
EVTOPTA_TOG_604;Now for the human sacrifice...;Et maintenant, le sacrifice humain...;Und jetzt zum Menschenopfer...;;Ahora, para el sacrificio humano...;;;;;;;x
EVTDESC_TOG_605;The time has come for the blot held by [From.GetTitledFirstName] to begin! You gather outside the temple, and start by offering animals as sacrifice to the gods. While their meat is prepared for the feast that is to follow, the blood is sprinkled on altars of the gods, as well as on the worshipers themselves.;;;;;;;;;;;x
EVTDESC_TOG_611;[From.GetTitledFirstName] is brought up from your dungeons and escorted to the temple. As the noose is placed around [From.GetHerHis] neck, [From.GetSheHe] steadies [From.GetHerselfHimself] and murmurs several passages that you recognize as being from an Estelar holy book.;On escorte [From.Get_le_TitledFirstName] depuis les cachots jusqu'au temple. Pendant qu'on lui passe la corde autour du cou, [From.GetIlElle] se tient fermement et murmure plusieurs passages que vous reconnaissez comme provenant du livre sacrÈ des chrÈtiens.;[From.GetTitledFirstName] wird aus Eurem Verlies geholt und zum Tempel eskortiert. Als eine Schlinge um [From.GetHerHis]en Hals gelegt wird, bleibt [From.GetSheHe] standhaft und murmelt zahlreiche Verse, die Ihr als Passagen aus dem christlichen Heiligen Buch erkennt.;;[From.GetTitledFirstName] es traÌdo de tu mazmorra y escoltado al templo. Mientras le ponen la soga alrededor de [From.GetHerHis] cuello, [From.GetSheHe] se estabiliza a [From.GetHerselfHimself] y murmura varios pasajes que reconoces son del libro sagrado Cristiano.;;;;;;;x
EVTOPTA_TOG_611;Where are your gods now, [From.GetFirstName]?;Elle est o?, maintenant, votre Sainte Vierge, [From.GetFirstName]†?;Wo ist Eure Heilige Jungfrau jetzt, [From.GetFirstName]?;;øDÛnde est· tu SantÌsima Virgen ahora, [From.GetFirstName]?;;;;;;;x
EVTOPTB_TOG_611;No, perhaps this is a bad idea...;Non, ce n'est peut-Ítre pas une bonne idÈe...;Nein, das ist vielleicht eine schlechte Idee...;;No, tal vez esto es una mala idea...;;;;;;;x
terrible_armor_desc;Extremely cheap ring mail armor.;;;;;;;;;;;x
EVTOPTA_MNM_40000_SWORD;This sword will be known as Dragonslayer!;Cette ÈpÈe sera connue comme la Chasseuse de Dragon†!;Dieses Schwert wird als Drachensucher bekannt!;;°La espada se llamar· Buscacorazones!;;;;;;;x
EVTOPTA_MNM_40000_LANCE;This lance will be known as Suzail!;Cette lance sera connue sous le nom d'Ascalon†!;Diese Lanze wird als Askalon bekannt!;;°La lanza se llamar· AscalÛn!;;;;;;;x
EVTOPTB_MNM_40000_SWORD;My every foe shall fear Celestia's Vengeance!;Mes ennemis vont craindre la Vengeance des Cieux†!;Jeder Feind soll die Rache des Himmels f¸rchten!;;°Todos mis enemigos temer·n la Venganza del Cielo!;;;;;;;x
EVTOPTB_MNM_40000_LANCE;My every foe shall fear the Oceanic Trident!;Mes ennemis craindront ma Lance Sanglante†!;Jeder Feind soll die blutige Lanze f¸rchten!;;°Todos mis enemigos temer·n la Lanza Sangrienta!;;;;;;;x
EVTOPTB_MNM_40000_AXE;My every foe shall fear the Divine Devastator!;Mes ennemis craindront ma DÈvastatrice des Cieux†!;Jeder Feind soll den Himmelsverw¸ster f¸rchten! ;;°Todos mis enemigos temer·n la Devastadora del Cielo!;;;;;;;x
EVTOPTB_MNM_40000_ARMOR;This will be my Elven Armor.;Ce sera mon Armure Verte.;Diese R¸stung wird meine Gr¸ne R¸stung sein.;;Esta ser· mi Armadura verde;;;;;;;x
EVTOPTC_MNM_40000_SWORD;She looks like a [Root.Religion.GetHighGodName]'s Fury, doesn't she?;Elle ressemble ‡ la Furie [Root.Get_du_HighGod], n'est-ce pas†?;Es sieht wie der Zorn von [Root.Religion.GetHighGodName] aus, nicht?;;Parece la Furia de [Root.Religion.GetHighGodName], øverdad?;;;;;;;x
#####DnD Inspired Loc For Vanilla Crafted Weapons And Armor######;;;;;;;;;;;;x
###TIER 4###;;;;;;;;;;;;x
sword_tier_4_heartseeker;Dragonslayer +3;Chasseuse de Dragon +3;Drachensucher +3;;Buscacorazones +3;;;;;;;x
sword_tier_4_vengeance;Celestia's Vengeance +3;Vengeance des Cieux +3;Rache des Himmels +3;;Venganza del Cielo +3;;;;;;;x
sword_tier_4_fury;[Root.Religion.GetHighGodName]'s Fury +3;Furie [Root.Get_du_HighGod];[Root.Religion.GetHighGodName]s Zorn;;Furia de [Root.Religion.GetHighGodName];;;;;;;x
scimitar_tier_4_golden;Golden Vengeance +3;Vengeance DorÈe;Goldene Vergeltung;;Venganza dorada;;;;;;;x
scimitar_tier_4_fortune;Scimitar of the Night +3;Cimeterre de la Nuit;Krumms‰bel der Nacht;;Cimitarra de la Noche;;;;;;;x
scimitar_tier_4_conquest;Scimitar of Death +3;Cimeterre de la Mort;Krumms‰bel des Todes;;Cimitarra de la Muerte;;;;;;;x
lance_tier_4_impaler;Suzail +3;Suzail +3;Suzail +3;;Suzail +3;;;;;;;x
lance_tier_4_trident;Oceanic Trident +3;Lance Sanglante;Blutige Lanze;;Lanza Sangrienta;;;;;;;x
lance_tier_4_piercer;Death Strike +3;Coup Mortel;Todessto?;;Golpe de Muerte;;;;;;;x
axe_tier_4_cleaver;The Dragon Cleaver +3;Fendoir de Dragon;Drachenspalter;;Destripadragones;;;;;;;x
axe_tier_4_ravager;Divine Devastator +3;DÈvastatrice des Cieux;Himmelsverw¸ster;;Devastadora del Cielo;;;;;;;x
axe_tier_4_marauder;Darkbringer +3;Messager des TÈnËbres;Dunkelbringer;;Heraldo de Oscuridad;;;;;;;x
mace_tier_4_foe_hammer;Skullcrusher +3;Briseuse de Cr‚nes;Sch‰delzertr¸mmerer;;Partecr·neos;;;;;;;x
mace_tier_4_bone_breaker;Twilight's Hammer +3;Marteau du CrÈpuscule;Zwielicht Hammer;;Martillo del Crep?sculo;;;;;;;x
mace_tier_4_shatterer;Giant Shatterer +3;GÈante Briseuse;Riesentˆter;;Desmenuzagigantes;;;;;;;x
bow_tier_4_silent_wind;Death Wind +3;Souffle de la Mort;Todeswind;;Viento de Muerte;;;;;;;x
bow_tier_4_lightning;Lightning Strike +3;Attaque Foudroyante;Blitzschlag;;Golpe rel·mpago;;;;;;;x
bow_tier_4_eagle;Ice Eagle +3;Aigle de Glace;Eisadler;;¡guila de hielo;;;;;;;x
armor_tier_4_guardian;Angelic Guardian +3;Gardienne AngÈlique;Engelsw‰chter;;Guardi·n angÈlico;;;;;;;x
armor_tier_4_champion;Elven Armor +3;Armure Verte;Gr¸ne R¸stung;;Armadura verdad;;;;;;;x
armor_tier_4_warden;Immortal +3;Immortelle;Unbezwingbar;;Inmortal;;;;;;;x
sword_tier_4_heartseeker_desc;A legendary blade said to rip through the flesh of Dragons.;Une lame lÈgendaire rÈputÈe fendre la chair des dragons.;Eine legend‰re Klinge, die angeblich durch das Fleisch von Drachen schneidet.;;Una hoja legendaria, se dice que;;;;;;;x
sword_tier_4_vengeance_desc;A legendary blade said to be the very embodiment of Heaven's anger.;Une lame lÈgendaire rÈputÈe Ítre l'incarnation mÍme de la colËre des Cieux.;Eine legend‰re Klinge, die angeblich die Verkˆrperung des Zorns des Himmels ist.;;Una hoja legendaria, se dice que;;;;;;;x
sword_tier_4_fury_desc;A legendary blade said to be crafted with the fury of [Root.Religion.GetHighGodName].;Une lame lÈgendaire conÁue avec la fureur [Root.Get_du_HighGod].;Eine legend‰re Klinge, die angeblich durch den Zorn von [Root.Religion.GetHighGodName] geschmiedet wurde.;;Una hoja legendaria, se dice que;;;;;;;x
scimitar_tier_4_golden_desc;A legendary scimitar crafted out of gold.;Un cimeterre lÈgendaire en or.;Ein legend‰rer Krumms‰bel aus Gold;;Una cimitarra legendaria hecha de oro;;;;;;;x
scimitar_tier_4_fortune_desc;A legendary scimitar rumored to be infused with all the souls of those who have died during the night.;Un cimeterre lÈgendaire dont la rumeur veut qu'il soit imprÈgnÈ de toutes les ‚mes de ceux qui sont morts pendant la nuit.;Ein legend‰rer Krumms‰bel, der angeblich mit den Seelen derer, die in der Nacht gestorben sind, gef¸llt ist.;;Una cimitarra legendaria supuestamente imbuida con el alma de quienes murieron de noche.;;;;;;;x
scimitar_tier_4_conquest_desc;A legendary scimitar rumored to be the embodiment of death.;Un cimeterre lÈgendaire qui serait l'incarnation de la mort.;Ein legend‰rer Krumms‰bel, der angeblich dem Tod selbst gehˆrte.;;Una cimitarra legendaria, se dice es la encarnaciÛn de la Muerte.;;;;;;;x
lance_tier_4_impaler_desc;Said to be the re-crafted legendary spear of King Azoun II.;RÈputÈe Ítre la lance lÈgendaire recrÈÈe de saint George.;Angeblich der legend‰re Speer des Heiligen Georgs.;;Se dice que es la recreaciÛn de la lanza legendaria de san Jorge.;;;;;;;x
lance_tier_4_trident_desc;A legendary trident that is said to be made with the bones of a great leviathan.;Une lance lÈgendaire qui saigne comme le Messie qu'elle a dÈj‡ percÈ.;Ein legend‰rer Speer, der angeblich so wie der Messias blutet, den er einst durchbohrt hat.;;Una lanza legendaria, se dice que sangra como el MesÌas al que atravesÛ.;;;;;;;x
lance_tier_4_piercer_desc;A legendary spear rumored to be able to pierce any material no matter how strong.;Une lance lÈgendaire reconnue pour Ítre capable de transpercer n'importe quel matÈriau.;Ein legend‰rer Speer, der jedes Material durchdringen kann.;;Un hacha legendaria de la que se rumorea puede atravesar cualquier material, no importa su fuerza.;;;;;;;x
axe_tier_4_cleaver_desc;A legendary ax said to have cleaved through countless dragons.;Une hache lÈgendaire qui aurait fendu d'innombrables dragons.;Eine legend‰re Axt, die unz‰hlige Drachen gespaltet haben soll.;;Un hacha legendaria, se dice ha rajado a innumerables dragones.;;;;;;;x
axe_tier_4_ravager_desc;A legendary ax rumored to have been wielded by [Root.Religion.GetHighGodName]'s messengers.;Une hache lÈgendaire qui aurait ÈtÈ brandie par les messagers [Root.Get_du_HighGod].;Eine legend‰re Axt, die angeblich dem Abgesandten von [Root.Religion.GetHighGodName] gehˆrte.;;Un hacha legendaria, se rumorea que fue blandida por los mensajeros de [Root.Religion.GetHighGodName].;;;;;;;x
axe_tier_4_marauder_desc;A legendary ax rumored to be infused by the very essence of night.;Une hache lÈgendaire qui serait imprÈgnÈe par l'essence mÍme de la nuit.;Eine legend‰re Axt. die angeblich von der Essenz der Nacht durchdrungen ist.;;Una maza legendaria supuestamente imbuida con la esencia de la noche.;;;;;;;x
mace_tier_4_foe_hammer_desc;A legendary mace said to have crushed an innumerable amount of foes.;Une masse lÈgendaire qui aurait ÈcrasÈ un nombre incalculable d'ennemis.;Ein legend‰rer Streitkolben, der Unmengen Feinde vernichtet haben soll.;;Una maza legendaria, se dice que ha aplastado cantidades ingentes de enemigos.;;;;;;;x
mace_tier_4_bone_breaker_desc;A legendary mace said to be infused by the very essence of night.;Une masse lÈgendaire qui serait imprÈgnÈe par l'essence mÍme de la nuit.;Ein legend‰rer Streitkolben, der angeblich von der Essenz der Nacht durchdrungen ist.;;Una maza legendaria supuestamente imbuida con la esencia de la noche.;;;;;;;x
mace_tier_4_shatterer_desc;A legendary mace said to be crafted out of the bones of giants.;Une masse lÈgendaire censÈe Ítre fabriquÈe ‡ partir des os des gÈants.;Ein legend‰rer Streitkolben, der angeblich aus den Knochen von Riesen geschmiedet wurde.;;Una maza legendaria, se cuenta que la hicieron con los huesos de gigantes.;;;;;;;x
bow_tier_4_silent_wind_desc;A legendary bow said to be infused with the souls of the dead.;Un arc lÈgendaire dit Ítre imprÈgnÈ des ‚mes des morts.;Ein legend‰rer Bogen, der angeblich mit den Seelen der Toten gef¸llt ist.;;Un arco legendario, supuestamente imbuido con las almas de los muertos.;;;;;;;x
bow_tier_4_lightning_desc;A legendary bow said to be crafted in the middle of a storm, and infused with its very essence.;Un arc lÈgendaire dit avoir ÈtÈ conÁu au milieu d'une tempÍte et imprÈgnÈ de son essence.;Ein legend‰rer Bogen, der angeblich inmitten eines Sturm geschmiedet wurde und mit seiner Essenz gef¸llt ist.;;Un arco legendario, se dice que lo hicieron durante una tormenta, cuya misma esencia tiene imbuida.;;;;;;;x
bow_tier_4_eagle_desc;A legendary bow said to have been crafted out of the bones a roc.;Un arc lÈgendaire dit avoir ÈtÈ fabriquÈ ‡ partir des os d'un aigle mythique.;Ein legend‰rer Bogen, der angeblich aus den Knochen eines mysteriˆsen Adlers gebaut wurde.;;Un arco legendario, se dice que fue hecho con los huesos de un ·guila mÌtica.;;;;;;;x
armor_tier_4_guardian_desc;A legendary armor rumored to be forged with pieces of a Solar's armor.;Une armure lÈgendaire qui aurait ÈtÈ portÈe par les anges.;Eine legend‰re R¸stung, die einst ein Engel getragen haben soll.;;Una armadura legendaria, se rumorea que la vistieron los ·ngeles.;;;;;;;x
armor_tier_4_champion_desc;A legendary armor said to be reforged from ancient elven cuirasses.;Une armure lÈgendaire qui aurait ÈtÈ portÈe par le chevalier vert des lÈgendes du roi Arthur.;Eine legend‰re R¸stung, die vom Gr¸nen Ritter der Legende von Arthur getragen worden sei.;;Una armadura legendaria, se dice que la vistiÛ el Caballero verde de las leyendas art?ricas.;;;;;;;x
armor_tier_4_warden_desc;A legendary armor said to be indestructible by any mortal means.;Une armure lÈgendaire dite indestructible pour les mortels.;Eine legend‰re R¸stung, die angeblich mit sterblichen Mitteln unzerstˆrbar ist.;;Una armadura legendaria, se dice que es indestructible contra todos los medios mortales.;;;;;;;x
###TIER 1 2 3###;;;;;;;;;;;;x
sword_tier_1;Masterwork Sword;…pÈe;Standardschwert;;Espada de caballero;;;;;;;x
sword_tier_1_desc;A common sword type worn by many in battle.;Un type d'ÈpÈe possÈdÈ par beaucoup sur le champ de bataille.;Ein gewˆhnliches Schwert, wie es von vielen in der Schlacht verwendet wird.;;Un tipo de espada com?n muy utilizada en la batalla.;;;;;;;x
sword_tier_2;Longsword +1;…pÈe longue;Langschwert;;Espada larga;;;;;;;x
sword_tier_2_desc;An enchanted longsword of fine steel. A capable sword that will inflict great damage on its foes.;Une ÈpÈe longue en acier pur. Une ÈpÈe capable d'infliger de grands dÈg‚ts ‡ ses ennemis.;Ein Langschwert aus gutem Stahl. Brauchbares Schwert, das gro?en Schaden anrichtet.;;Una espada larga de acero fino. Una espada con gran capacidad para infligir mucho daÒo a sus enemigos.;;;;;;;x
sword_tier_3_heartseeker;Heartseeker +2;La Transperceuse de Coeurs;Herzsucher;;Buscacorazones;;;;;;;x
sword_tier_3_heartseeker_desc;A high quality sword, known as Heartseeker. Named after its ability to pierce any armor, it is sure to bring enemies to a swift fate.;Une ÈpÈe de qualitÈ supÈrieure, connue sous le nom de la Transperceuse de Coeurs. NommÈe d'aprËs sa capacitÈ ‡ transpercer toute armure, elle apporte aux ennemis un destin rapide.;Qualitativ hochwertiges Schwert, das Herzsucher genannt wird, da es jede R¸stung durchdringen kann und dem Feind ein rasches Ende beschert.;;Una espada de gran calidad, conocida como Buscacorazones. Debe su nombre a su habilidad para perforar cualquier armadura y garantiza dirigir a tus enemigos a una muerte inminente.;;;;;;;x
sword_tier_3_vengeance;Vengeance +2;La Vengeresse;Vergeltung;;Venganza;;;;;;;x
sword_tier_3_vengeance_desc;Forged with cold iron, the sword was named Vengeance, to bring certain doom to any traitor.;ForgÈe avec le meilleur acier disponible, l'ÈpÈe a ÈtÈ appelÈe Vengeresse, pour apporter une condamnation certaine ‡ n'importe quel traÓtre.;Geschmiedet aus dem absolut hochwertigsten Stahl und gefertigt zum Zweck, einen Verr‰ter garantiert zur Strecke zu bringen.;;Esta espada, forjada con el mejor acero existente, recibiÛ el nombre de Venganza para acarrear la ruina a cualquier traidor.;;;;;;;x
sword_tier_3_fury;Fury +2;La Furie;Furie;;Furia;;;;;;;x
sword_tier_3_fury_desc;A great and magnificent sword known as Fury. Swift in hand-to-hand combat as well as battle, it is sure to bring victory to the one who wields it.;Une grande et magnifique ÈpÈe connue sous le nom de Furie. Rapide dans le combat au corps-‡-corps ainsi que dans la bataille, elle apporte la victoire ‡ celui qui la brandit.;Gro?es und pr‰chtiges Schwert, das "Furie" getauft wurde. Gleicherma?en geeignet f¸r den Zweikampf und f¸r die Schlacht. Der Sieg ist seinem Tr‰ger so gut wie sicher.;;Una espada magnÌfica y gloriosa conocida como Furia. R·pida en combate cuerpo a cuerpo, asÌ como en la batalla. Traer· la victoria a quienquiera que la blanda.;;;;;;;x
scimitar_tier_1;Masterwork Scimitar;Cimeterre;Krumms‰bel;;Cimitarra;;;;;;;x
scimitar_tier_1_desc;A scimitar of finer quality than your common blade.;Un cimeterre de meilleure qualitÈ que la lame commune.;Ein Krumms‰bel in besserer Qualit‰t als die normale Blankwaffe.;;Una cimitarra de mejor calidad que una espada com?n.;;;;;;;x
scimitar_tier_2;Scimitar +1;Cimeterre supÈrieur;Guter Krumms‰bel;;Cimitarra refinada;;;;;;;x
scimitar_tier_2_desc;A well-forged enchanted blade that can stand against most weapons.;Une lame bien forgÈe qui peut rÈsister ‡ la plupart des armes.;Eine kompetent geschmiedete Klinge, die mit den meisten Waffen mithalten kann.;;Una hoja bien forjada que puede resistir contra casi cualquier arma.;;;;;;;x
scimitar_tier_3_golden;The Golden Scimitar +2;Le Cimeterre d'Or;Goldener Krumms‰bel;;La Cimitarra Dorada;;;;;;;x
scimitar_tier_3_golden_desc;Named The Golden Scimitar, it is a weapon of exceptional quality forged by a master craftsman. The handle is adorned with ornaments made of gold and jewels.;NommÈ le Cimeterre d'Or, c'est une arme d'une qualitÈ exceptionnelle forgÈe par un maÓtre-artisan. Les ornements du manche sont faits d'or et de joyaux.;Diese Waffe namens "Goldener Krumms‰bel" wurde in au?erordentlicher Qualit‰t von einem Meister seines Faches geschmiedet. Heft und Knauf sind mit Ornamenten aus Gold und Edelsteinen verziert.;;Esta arma, llamada la Cimitarra Dorada, es de una calidad excepcional y est· forjada por un maestro artesano. La empuÒadura est· adornada con oro y joyas.;;;;;;;x
scimitar_tier_3_fortune;Scimitar of Fortune +2;Le Cimeterre de Fortune;Krumms‰bel des Gl¸cks;;Cimitarra de la Fortuna;;;;;;;x
scimitar_tier_3_fortune_desc;A blade of the finest steel and a handle inlaid with gold. Named the Scimitar of Fortune, it is said to bestow the owner with luck.;Une lame du meilleur acier et une poignÈe incrustÈe d'or. NommÈ le Cimeterre de Fortune, il est rÈputÈ confÈrer de la chance ‡ son dÈtenteur.;Eine Klinge aus bestem Stahl, in deren Heft Gold eingearbeitet wurde. Wie es hei?t, soll der Tr‰ger dieses S‰bels das Gl¸ck auf seiner Seite haben.;;Una hoja del acero m·s refinado y una empuÒadura taraceada con oro. Se dice que esta Cimitarra de Fortuna trae suerte a su propietario.;;;;;;;x
scimitar_tier_3_conquest;Scimitar of Conquest +2;Le Cimeterre de ConquÍte;S‰bel der Eroberung;;Cimitarra de Conquista;;;;;;;x
