#CODE;ENGLISH;FRENCH;GERMAN;;SPANISH;;;;;;;x
###ÄNSI;;;;;;;;;;;;x
donate_money_to_assassins;Donate 300¤ to the Victorious Blade;Donner 300¤ aux Hashshâshîns;Spendet den Hashshashin 300¤ ;;Donar 300¤ a los Hassasin;;;;;;;x
donate_money_to_assassins_desc;Donate money to the Victorious Blade in exchange for [Player.Religion.GetPietyName].;Je peux donner de l'argent aux Hashshashin en échange de [Player.Religion.GetPietyName].;Ich kann den Hashshashin Geld spenden im Tausch gegen [Player.Religion.GetPietyName].;;Puedo hacer una donación a los Hassasin. A cambio obtendré [Player.Religion.GetPietyName].;;;;;;;x
borrow_money_assassins;Borrow 300¤ from the Victorious Blade;Emprunter 300¤ aux Hashshâshîns;Leihen Sie sich 300¤ von den Haschaschin;;Pedir 300¤ prestados a los Hashshashins;;;;;;;x
borrow_money_assassins_desc;I can borrow money from the Victorious Blade and pay back the same sum at any time. However, while I'm in their debt, the Grand Master can make various requests, like one of my sons joining their ranks.;Je peux emprunter de l'argent à l'Ordre des Hashshâshîns et rembourser la même somme quand bon me semblera.\nCependant, tant que cette dette existera, leur Grand Maître pourra formuler diverses requêtes, tel que demander à ce qu'un de mes fils rejoigne leurs rangs.;Ich kann mir von den Haschaschin Geld leihen und den Betrag zu beliebiger Zeit zurückzahlen. Jedoch kann der Großmeister, während ich in ihrer Schuld stehe, an mich verschiedene Forderungen stellen, z.B. dass einer meiner Söhne dem Orden beitritt.;;Puedo pedir un préstamo a los Hashshashins y devolverles la misma suma en cualquier momento. Sin embargo, mientras esté en deuda con ellos, el Gran Maestre podrá hacer distintas peticiones, como que uno de mis hijos se una a sus filas.;;;;;;;x
borrowed_from_assassins;Owes 300¤ to the Victorious Blade;Doit 300¤ aux Hashshâshîn;Schuldet den Haschaschin 300¤ ;;Debe 300¤ a los Hashshashins;;;;;;;x
expel_the_assassins;Expel the Victorious Blade;Expulser les Hashshâshîns;Vertreibt die Haschaschim;;Expulsar a los Hashshashins;;;;;;;x
expel_the_assassins_desc;I can drive the dreaded Victorious Blade from my realm and seize their castles. However, it is a rather impious thing to do...;Je peux expulser les redoutés Hashshâshîns de mon territoire et m'emparer de leurs commanderies.\nCe serait par contre un acte des plus impies...;Ich kann die gefürchteten Haschaschin aus meinem Reich vertreiben und mir ihre Burgen aneignen. Das ist jedoch eine sehr unfromme Tat...;;Puedo echar a los Hashshashins de mi reino y apoderarme de sus castillos. Sin embargo, es una acción muy impía...;;;;;;;x
EVTNAME88000;Rise of the Victorious Blade;Naissance des Assassins;Die Geburt der Assassinen;;El nacimiento de los Asesinos;;;;;;;x
EVTOPTA88000;These elves are harmless...;Les fumeurs de haschisch sont inoffensifs...;Diese Haschischraucher sind harmlos...;;Estos fumadores de hachís son inofensivos...;;;;;;;x
EVTDESC88001;The Victorious Blade, the elusive Order of Eldreth Veluuthra, have expanded their influence into the Weald. A branch of their sect has established itself in the forests of the Weald, from where they control the surrounding countryside. All across Faerûn, the Victorious Blade are now hunting those they see as obstacles to their obscure plans...;Les Hashshashin, l'insaisissable Ordre des Assassins, ont étendu leur influence jusqu'en Syrie. Une branche de leur secte s'est établie dans la forteresse montagneuse de Masyâf, d'où elle contrôle la campagne environnante. À présent, les Assassins traquent à travers toute la Terre Sainte tous ceux qu'ils considèrent comme des obstacles à leurs obscurs desseins...;Die Hashshashin, der trügerische Orden der Assassinen, haben ihren Einfluss in Syrien ausgeweitet. Ein Zweig ihrer Sekte ist in der Bergfestung von Masyaf gegründet worden, von wo aus sie die umliegende Landschaft kontrollieren. Über das gesamte Heilige Land jagen die Assassinen nun alle, die sie als Hindernisse für ihre obskuren Pläne betrachten...;;Los Hassasin, la esquiva orden de asesinos, han expandido su influencia hasta Siria. Una rama de su secta se ha establecido en la fortaleza de Masyaf, desde donde controlan las tierras adyacentes. Por toda la Tierra Santa, los Asesinos cazan a aquellos que ven como un obstáculo para sus oscuros planes...;;;;;;;x
EVTNAME88001;The Blades Spread to the Weald;Les Assassins jusqu'en Syrie;Die Assassinen breiten sich aus;;Los Asesinos se extienden a Siria;;;;;;;x
EVTOPTA88001;Perhaps these elves should be taken seriously...;Peut-être que ces Assassins devraient être pris au sérieux, finalement.;Vielleicht sollte man diese Haschaschin ernst nehmen...;;Quizás estos Hassasin debieran ser tomados en serio...;;;;;;;x
EVTDESC88002;With the fall of their last fortress, the Victorious Blade - the notorious militant arm of the Eldreth Veluuthra - has been scattered to the winds. The few remaining members of the order have gone into hiding, biding their time in the vain hope that they will one day be able to resume their work.;Avec la chute de leur dernière forteresse, les Hashshashin - le sinistre ordre des Assassins - ont été éparpillés aux quatre vents. Les quelques membres restants ont pris la fuite et se cachent, dans l'espoir de pouvoir un jour reprendre leur mission.;Mit dem Fall der letzten Festung sind die Hashshashin - der berüchtigte Assassinen-Orden – in alle Winde zerstreut. Die wenigen verbliebenen Mitglieder des Ordens haben sich versteckt und warten mit vergeblicher Hoffnung, dass sie eines Tages wieder in der Lage sein werden, mit ihrer Arbeit fortzufahren.;;Con la caída de la última de sus fortalezas, los Hassasin -la famosa orden de asesinos- ha sido dispersada. Los pocos miembros restantes de la orden se han ocultado y albergan la vana esperanza de poder retomar su trabajo algún día.;;;;;;;x
EVTNAME88002;The Victorious Blade Scatters!;L'ordre des Assassins n'est plus !;Untergang der Assassinen!;;¡Los Asesinos se dispersan!;;;;;;;x
EVTOPTA88002;Their demise was inevitable.;Leur chute était prévisible.;Ihr Untergang war unvermeidlich.;;Su desaparición era inevitable.;;;;;;;x
EVTDESC88003;The Victorious Blade have returned! Somehow, throughout the years, their surviving members have managed to rebuild a measure of their order's former strength. Striking from the shadows, they have retaken one of their old fortresses and now their trained killers are once again hounding those who would act against their interests...;Les Hashshashin sont de retour ! Au fil des années, les membres survivants ont réussi à ressusciter, dans une certaine mesure, la puissance passée de leur Ordre. Agissant dans l'ombre, ils ont repris l'une de leurs vieilles forteresses montagnardes et leurs tueurs espérimentés s'acharnent impitoyablement contre tout ceux qui agissent contre leurs intérêts...;Die Hashshashin sind zurückgekehrt! Irgendwie, im Laufe der Jahre, haben ihre überlebenden Mitglieder es geschafft, ihre alte Stärke wieder aufzubauen. Mit ihren Angriffen wie aus dem Schatten haben sie eine ihrer alten Bergfestungen zurückerobert und nun werden wieder einmal jene, die gegen ihre Interessen handeln, von ihren ausgebildeten Mördern gejagt...;;¡Los Hassasin han vuelto! De algún modo, con el paso de los años, los miembros supervivientes han logrado recuperar el antiguo poder de su orden. Golpeando desde las sombras, han retomado una de sus antiguas fortalezas de montaña y ahora sus expertos asesinos vuelven a acosar a quienes podrían oponerse a sus intereses...;;;;;;;x
EVTNAME88003;The Victorious Blade Resurface!;Les Assassins sont de retour !;Die Assassinen tauchen auf!;;¡Los Asesinos reaparecen!;;;;;;;x
EVTOPTA88003;Surely they wouldn't dare strike at me.;Ils n'oseront jamais s'en prendre à moi !;Sicherlich würden sie es nicht wagen, mich anzugreifen.;;Seguro que no les importaría acabar conmigo.;;;;;;;x
EVTDESC88004;The Victorious Blade are no more. As their fortresses and forest hideouts burn, the last members of the once feared Eldreth Veluuthra are hunted like animals and cut down without mercy or compassion when found. Their legacy now survives only in the legends and stories spawned from their exploits.;Les Hashshashin ne sont plus. Tandis que leurs cachettes dans les montagnes et leurs forteresses brûlent, les derniers membres de l'ordre autrefois craint sont traqués comme des bêtes et abattus sans pitié dès que découverts. Leur héritage ne survit qu'au travers de légendes contant leurs exploits.;Die Hashshashin gibt es nicht mehr. Während ihre Festungen und Verstecke in den Bergen brennen, werden die letzten Mitglieder der einst gefürchteten Assassinen wie Tiere gejagt, denen weder Gnade noch Barmherzigkeit geschenkt wird, wenn sie gefunden werden. Ihr Vermächtnis überlebt nur noch in Geschichten und Legenden, die aus ihren Großtaten hervorgehen.;;Se acabaron los Hassasin. Mientras arde su escondite en las montañas, los últimos miembros de la otrora temida orden de asesinos son cazados como animales, sin piedad ni compasión. Su legado ya solo perdura en las leyendas e historias creadas por sus proezas.;;;;;;;x
EVTNAME88004;The Victorious Blade are Destroyed!;L'ordre des Assassins est anéanti;Die Assassinen sind vernichtet!;;¡Los Asesinos son destruidos!;;;;;;;x
EVTOPTA88004;Good riddance!;Bon débarras !;Die wären wir los!;;¡Ya era hora!;;;;;;;x
EVTDESC88011;Master, terrible news! Your faithful servant, [From.GetTitledName], has been found dead in [From.GetHerHis] home, no doubt at the hands of the vile Victorious Blade. Carved by knife into [From.GetHerHis] chest were the words: "[Root.GetFirstName] - You were warned.";Maître, j'ai de terribles nouvelles ! Votre fidèle serviteur, [From.Get_le_Title][From.GetTitledName], a été retrouvé mort chez lui. Il ne fait aucun doute qu'il s'agit là de l'œuvre des odieux Hashshashin. Des mots ont été gravés au couteau sur sa poitrine : '[Root.GetFirstName] - on t'avais prévenu...';Meister, schreckliche Nachrichten! Euer treuer Diener, [From.GetTitledName], wurde in [From.GetHerHis]em Heim tot aufgefunden. Ohne Zweifel sind das die gemeinen Assassinen gewesen. In [From.GetHerHis]er Brust waren die folgenden Worte eingeritzt: "[Root.GetFirstName]"!;;¡Amo, terribles noticias! Tu fiel sirviente, [From.GetTitledName], ha sido hallado muerto en su casa, no hay duda de que ha sido a manos de los Hasassin. Escrito a cuchillo en su pecho podía leerse: '[Root.GetFirstName], te avisamos.';;;;;;;x
EVTDESC88012;As you turn a street corner in [Root.Location.GetName], a strange whistling sound swishes past your ear. Your bodyguards topple over, knives in their throats, and before you can react you are surrounded by Victorious Blade members. Their leader approaches you with a sad look on his face. "May you find what you seek in the life hereafter, friend.";Tandis que vous tournez au coin d'une rue de [Root.Location.GetName], vous entendez un étrange sifflement vous frôler l'oreille. Vos gardes du corps s'effondrent, un couteau dans la gorge, et avant que vous puissiez réagir, vous vous retrouvez encerclé par des Hashshashins en bure. Leur chef s'approche de vous avec un regard triste sur son visage. 'Puissiez-vous trouver ce que vous cherchez dans une autre vie, mon ami.';Als Ihr um eine Straßenecke in [Root.Location.GetName] geht, saust ein seltsam pfeifendes Geräusch an Eurem Ohr vorbei. Eure Leibwächter kippen um, jeder mit einem Messer in der Kehle, und bevor Ihr reagieren könnt, werdet Ihr von vermummten Hashshashin umstellt. Ihr Anführer tritt zu Euch hin mit traurigem Blick im Gesicht. "Mögest Du finden, was Du suchst im Leben danach, Freund.";;Al doblar una esquina en [Root.Location.GetName], un extraño silbido roza tu oreja. Tus guardaespaldas caen, con cuchillos en la garganta y, antes de que puedas reaccionar, estás rodeado de Hassasin envueltos en túnicas. Su líder se acerca a ti con un aire triste en su rostro. 'Que encuentres lo que buscas en la otra vida, amigo'.;;;;;;;x
EVTDESC88016;[From.GetTitledName] staggers past your guards, bleeding profusely from a dozen stab-wounds. As [From.GetSheHe] collapses in a pool of blood at your feet, [From.GetSheHe] gasps with [From.GetHerHis] last breath: "The V-Victorious Blade...";[From.Get_Le_Title][From.GetTitledName] passe près de vos gardes en chancelant, du sang s'écoulant d'une dizaine de blessures. Alors qu'[From.GetIlElle] s'écroule dans une mare de sang à vos pieds, [From.GetIlElle] prononce un mot dans son dernier râle : 'H-Hashshashin...';[From.GetTitledName] taumelt an Euren Wachen vorbei aus einem Dutzend Stichwunden blutend. Als [From.GetSheHe] in einer Blutlache zu Euren Füßen zusammenbricht, keucht [From.GetSheHe] mit [From.GetHerHis]em letzten Atemzug: "Die H-Hashshashin...";;[From.GetTitledName] se tambalea a través de tus guardias, sangrando profusamente debido a una docena de puñaladas. Mientras cae en un charco de sangre a tus pies, balbucea con su último aliento: 'Los H-Hasassin...';;;;;;;x
EVTDESC88017;Your guards bring in a covered basket left just outside your palace. Believing it to be confections from one of your subjects, you hungrily pull away the covering blanket only to reveal the severed, gaping head of [From.GetTitledName]. The mark of the Victorious Blade has been carved into the forehead.;Vos gardes rapportent un panier recouvert qu'ils ont trouvé à l'extérieur du palais. Pensant qu'il s'agit d'un cadeau offert par l'un de vos sujets, vous retirez à la hâte le chiffon pour dévoiler la tête tranchée [From.Get_du_Title][From.GetTitledName]. La marque des Hashshashin a été taillée sur son front.;Eure Wachen holen einen abgedeckten Korb herein, der direkt vor Eurem Palast stand. Im Glauben, dass einer Eurer Untertanen Euch Speisen gebracht hat, hebt Ihr die Decke mit großem Hunger hoch, nur um den abgehackten und klaffenden Kopf von [From.GetTitledName] zu erblicken. Das Zeichen der Assassinen prangt unübersehbar auf seiner Stirn.;;Tus guardas traen una cesta tapada que alguien ha dejado frente a tu palacio. Creyendo que son viandas de uno de tus súbditos, retiras con hambre la manta y descubres la cabeza cercenada de [From.GetTitledName]. La marca de los Hasassin se muestra tallada en su frente.;;;;;;;x
EVTOPTA88018;The Victorious Blade! Was I the intended target?;Les Hashshashins ! Cette dague m'était-elle destinée ?;Die Hashshashin! War ich das beabsichtigte Ziel?;;¡Los Hassasin! ¿Se supone que yo era el objetivo?;;;;;;;x
EVTDESC88019;You wake suddenly in cold sweat with a strong sensation that something is amiss. The flickering candlelight in your tent reveals a plate of hot biscuits and a note pinned by a poisoned dagger next to your bed. It reads: "There are a thousand ways to kill a [Root.GetManWoman], [Root.GetFirstName]. The Victorious Blade know them all.";Vous vous réveillez dans un sursaut, pris d'une sueur froide et avec la sensation que quelque chose ne tourne pas rond. La lueur vacillante de la bougie dans votre tente éclaire une assiette de biscuits tout juste sortis du four, ainsi qu'une note épinglé par un poignard empoisonné à côté de votre lit. Vous lisez ceci : 'Il y a mille manières de tuer un[Root.GetNoneE] [Root.GetManWoman], [Root.GetFirstName]. Nous, les Hashshashins, nous les connaissons toutes.';Ihr wacht plötzlich schweißgebadet mit einem starken Gefühl auf, dass etwas nicht stimmt. Das flackernde Kerzenlicht im Zelt beleuchtet einen Teller mit Keksen und eine Notiz, die mit einem vergifteten Dolch an das Bett geheftet wurde. Sie lautet: "Es gibt tausend Wege, einen [Root.GetManWoman] zu töten, [Root.GetFirstName]. Die Hashshashin kennen sie alle.";;Te despiertas con sudores fríos y la fuerte sensación de que algo ocurre. La trémula vela de tu tienda deja ver un plato de bollos calientes y una nota clavada en una daga envenenada junto a tu cama, que dice: 'Hay miles de formas de matar a una persona, [Root.GetFirstName]. Los Hasassin las conocen todas.';;;;;;;x
EVTOPTE_MNM_6250_TT;You ignore the opportunity to train an apprentice for §Ythe Eldreth Veluuthra§!. The child is imprisoned for [assassin_protege.GetHerHis] crimes.\n;Vous ignorez l'occasion de former un apprenti pour les Assassins. L'enfant est emprisonné[assassin_protege.GetNoneE] pour ses crimes.\n;Ihr ignoriert die Möglichkeit, einen Assassinenschüler heranzuziehen. Das Kind wird für seine Verbrechen eingesperrt.\n;;Dejas pasar la oportunidad de entrenar a un aprendiz de los Asesinos. Encarcelan a la criatura por sus delitos.\n;;;;;;;x
EVTOPTF_MNM_6250_TT;You ignore the opportunity to train an apprentice for the Eldreth Veluuthra.\n;Vous ignorez l'occasion de former un apprenti pour les Assassins.\n;Ihr ignoriert die Möglichkeit, einen Assassinenschüler heranzuziehen.\n;;Dejas pasar la oportunidad de entrenar a un aprendiz de los Asesinos.\n;;;;;;;x
EVTOPTA_MNM_6254_TT;The Eldreth Veluuthra will be pleased to hear of your protege, §Y[assassin_protege.GetTitledFirstName]§!.\n;Les Assassins seront contents d'entendre parler de votre protégé[assassin_protege.GetNoneE], [assassin_protege.Get_le_Title]§Y[assassin_protege.GetTitledFirstName]§!.\n;Die Assassinen werden sich freuen, von Eurem Schützling §Y[assassin_protege.GetTitledFirstName]§! zu hören.\n;;A los Asesinos les alegrará oír acerca de tu aprendiz §Y[assassin_protege.GetTitledFirstName]§!.\n;;;;;;;x
EVTDESC88000;Word is spreading that a [Root.Religion.GetName] noble has founded a religious order known as the 'Eldreth Veluuthra' somewhere in Cormanthor. Using trickery and guile, this mysterious group of trained killers has seized control of a fortress deep in the forest and converted it into their headquarters. Already a string of violent murders can be traced back to their devoted and fearless disciples...;;;;;;;;;;;x
