military_jesus;[Root.Religion.GetRandomGodName] Gives Military Advice;;;;;;;;;;;;;x
military_jesus_desc;This character seems to be blessed with the military advice of the divine.;;;;;;;;;;;;;x
voice_of_jesus;Voice of [Root.Religion.GetRandomGodName];;;;;;;;;;;;;x
voice_of_jesus_desc;Apparently the divine speaks to this character.;;;;;;;;;;;;;x
voice_of_satan;Voice of [Root.Religion.GetRandomEvilGodName];;;;;;;;;;;;;x
voice_of_satan_desc;Apparently the enemies of the faith speak to this character.;;;;;;;;;;;;;x
EVTOPTA1980;I like how this feels;;;;;;;;;;;;;x
EVTDESC1980;I find myself being drawn to others in new and exciting ways;;;;;;;;;;;;;x
EVTDESC1990;I find myself being drawn to others in new and exciting ways;;;;;;;;;;;;;x
EVTOPTALoR.886;Tell us more about this mythical realm of Malatra.;Dites-m'en plus sur ce royaume mythique d'Hindoustan.;Erzählt uns mehr über dieses mysteriöse Reich der Hindus.;;Cuéntanos más acerca de este mítico reino de Indostán.;;;;;;;;;x
CB_NAME_COUNTY_CONQUEST_desc;Rulers that follow the [Root.Religion.GetName] faith can conquer single border counties without specific reasons at the cost of 50 [This.Religion.GetPietyName].;;;;;;;;;;;;;x
muslim_county_conquest_desc;Rulers that follow the [Root.Religion.GetName] faith can conquer single border counties without specific reasons at the cost of 50 [This.Religion.GetPietyName].;;;;;;;;;;;;;x
true_christian_knight;Champion of the Estelar;;;;;;;;;;;;;x
DIPLOFLAVOR_INSULT_0;Tales of your misdeeds are told from Moonshae to Wa.;Vos méfaits sont connus depuis l'Irlande jusqu'à Cathay. ;von Euren Missetaten erzählt man sich von Irland bis China!;;Se cuentan historias de tus fechorías desde Irlanda hasta Catay.;;;;;;;;;x
DIPLOFLAVOR_INSULT_1;Your low character is the subject of Chessentan plays.;Votre bassesse est telle qu'elle a inspiré des pièces de théâtre grecques ! ;Euer niederer Charakter ist Mittelpunkt griechischer Theaterstücke!;;Tu escaso carácter es el tema de las obras de teatro griegas.;;;;;;;;;x
DIPLOFLAVOR_INSULT_muslim_2;May Fate ruin your house.;Qu'Allah détruise votre Maison ! ;möge Allah Euer Haus vernichten!;;Que Alá destruya tu casa.;;;;;;;;;x