military_jesus;[Root.Religion.GetRandomGodName] Gives Military Advice;Jésus prodigue des conseils militaires;Jesus gibt militärischen Rat.;;Jesús da consejo militar;;;;;;;;;x
military_jesus_desc;This character seems to be blessed with the military advice of the divine.;Jésus prodigue des conseils militaires;Jesus gibt militärischen Rat.;;Jesús da consejo militar;;;;;;;;;x
voice_of_jesus;Voice of [Root.Religion.GetRandomGodName];Voix de Satan;Die Stimme Satans;;Voz de Satán;;;;;;;;;x
voice_of_jesus_desc;Apparently the divine speaks to this character.;Voix de Satan;Die Stimme Satans;;Voz de Satán;;;;;;;;;x
voice_of_satan;Voice of [Root.Religion.GetRandomEvilGodName];Voix de Satan;Die Stimme Satans;;Voz de Satán;;;;;;;;;x
voice_of_satan_desc;Apparently the enemies of the faith speak to this character.;Voix de Satan;Die Stimme Satans;;Voz de Satán;;;;;;;;;x
EVTOPTA1980;I like how this feels;Ils m'attirent davantage.;Ich mag sie einfach lieber;;Ellos me gustan más;;;;;;;;;x
EVTDESC1980;I find myself being drawn to others in new and exciting ways;Ils m'attirent davantage.;Ich mag sie einfach lieber;;Ellos me gustan más;;;;;;;;;x
EVTDESC1990;I find myself being drawn to others in new and exciting ways;Ils m'attirent davantage.;Ich mag sie einfach lieber;;Ellos me gustan más;;;;;;;;;x