#CODE;ENGLISH;FRENCH;GERMAN;;SPANISH;;;;;;;x
chosen_auril;Chosen of Auril;;;;;;;;;;;x
chosen_auril_desc;Those chosen by Auril are selected with little consideration towards her Chosen's wishes. She tends to select those few her embody her fickleness, vanity, and icy-cold heart. Though those who wield the Ring of Winter can also count on her blessing.;;;;;;;;;;;x
chosen_gruumsh;Chosen of Gruumsh;;;;;;;;;;;x
chosen_gruumsh_desc;Those blessed by Gruumsh as his Chosen are given the strength of a bull, the speed of a wildcat, and increased intelligence. Perhaps most terrifying is that the Chosen is considered to be synonymous with Gruumsh and are called Who-Is-Gruumsh by other orcs.;;;;;;;;;;;x
chosen_lolth;Chosen of Lolth;;;;;;;;;;;x
chosen_lolth_desc;The Yor'thae, or "Chosen One" in High Drow are Lolth's most venerable priestesses. Those chosen by Lolth are, like their mistress, generally treacherous and cruel. They are Lolth's greatest tools and blessed with powerful abilities because of this.;;;;;;;;;;;x
chosen_mystra;Chosen of Mystra;;;;;;;;;;;x
chosen_mystra_desc;Those chosen by Mystra are concerned with fighting imbalances in the Weave. They are blessed with unprecedented magical power, magic sensing, immunities to magic, and even immunities to poison and disease.;;;;;;;;;;;x
chosen_ubtao;Chosen of Ubtao;;;;;;;;;;;x
chosen_ubtao_desc;The Barae, or Chosen of Ubtao, are the undying people who have traditionally ruled the holy city of Mezro as priest-kings. They were granted powerful regenerative and divine abilities and were rumored to turn to dust if Mezro would be destroyed.;;;;;;;;;;;x
chosen_sune;Chosen of Sune;;;;;;;;;;;x
chosen_sune_desc;Sune chooses her Chosens by their outward and inner beauty. They are expected to keep their appearance as flattering as possible and shower others with sweet words at least five times a month.;;;;;;;;;;;x
chosen_malar;Chosen of Malar;;;;;;;;;;;x
chosen_malar_desc;The Anth-Malar, as Malar's Chosen is called, is the Beastlord's most fervent worshipper. Malar's blessing turns his chosen into a furry and clawed, bestial humanoid.;;;;;;;;;;;x
chosen_seldarine;Chosen of the Seldarine;;;;;;;;;;;x
chosen_seldarine_desc;Only a select noble few receive the honor of being the Chosen of the entire Seldarine pantheon. Those that are selected receive an expansion of power that only the fellowship of brothers and sisters of the wood can grant.;;;;;;;;;;;x
chosen_umberlee;Chosen of Umberlee;;;;;;;;;;;x
chosen_umberlee_desc;The Chosen of Umberlee are primarily pirates or sea monsters who are able to properly stoke the ego of the Wavemother. Umberlee grants her Chosen a taste of her destructive power so they may spread terror in her name.;;;;;;;;;;;x
chosen_bane;Chosen of Bane;;;;;;;;;;;x
chosen_bane_desc;The Chosen of Bane are tyrants in every sense of the word, consumed with the quest for absolute power. They are both charismatic and filled with hate, preferring to dominate and instill fear in weaker beings.;;;;;;;;;;;x
chosen_bhaal;Chosen of Bhaal;;;;;;;;;;;x
chosen_bhaal_desc;The Chosen of Bhaal are supreme assassins and killers, selected for their ability to spread death without thought for morality.;;;;;;;;;;;x
chosen_talona;Chosen of Talona;;;;;;;;;;;x
chosen_talona_desc;The Chosen of Talona are plaguebearers blessed by their goddess with immunity to the effects of these contagions. Furthermore, they are masters of poison and seek to befoul all in their path.;;;;;;;;;;;x
chosen_eilistraee;Chosen of Eilistraee;;;;;;;;;;;x
chosen_eilistraee_desc;The Chosen of Eilistraee are champions of the cause of redemption for the drow and relentless foes of all the evil powers of the Underdark.;;;;;;;;;;;x
avatar;Avatar;;;;;;;;;;;x
avatar_desc;An avatar is the physical manifestation of a god on the material plane. An avatar does not age, and is in many ways imperishable. But if it should die, the god can recreate it in a matter of days.;;;;;;;;;;;x
sympathy_good_human_pantheon_group;Sympathy for Estelar worshippers;;;;;;;;;;;x
sympathy_good_human_pantheon_group_desc;This character, though not of an Estelar faith, has a special sympathy and understanding of the worshippers of the Estelar.;;;;;;;;;;;x
sympathy_wild_human_pantheon_group;Sympathy for worshippers of the Primal Gods.;;;;;;;;;;;x
sympathy_wild_human_pantheon_group_desc;This character, though not of an Primal God's faith, has a special sympathy and understanding of the worshippers of these gods.;;;;;;;;;;;x
sympathy_evil_human_pantheon_group;Sympathy for Dark Estelar worshippers;;;;;;;;;;;x
sympathy_evil_human_pantheon_group_desc;This character, though not of an Dark Estelar faith, has a special sympathy and understanding of the worshippers of the Dark Estelar Gods.;;;;;;;;;;;x
sympathy_zakharan_group;Sympathy for Zakharan worshippers;;;;;;;;;;;x
sympathy_zakharan_group_desc;This character, though not of a Zakharan faith, has a special sympathy and understanding of the worshippers of the Zakharans.;;;;;;;;;;;x
sympathy_karaturan_group;Sympathy for Kara-Turan worshippers;;;;;;;;;;;x
sympathy_karaturan_group_desc;This character, though not of a Kara-Turan faith, has a special sympathy and understanding of the worshippers of the Kara-Turan Gods and philosophies.;;;;;;;;;;;x
sympathy_elven_pantheon_group;Sympathy for the Elven Gods worshippers;;;;;;;;;;;x
sympathy_elven_pantheon_group_desc;This character, though not of an Elven faith, has a special sympathy and understanding of the worshippers of the Elven Gods.;;;;;;;;;;;x
sympathy_drow_pantheon;Sympathy for Drow Gods worshippers;;;;;;;;;;;x
sympathy_drow_pantheon_desc;This character, though not of a Drow faith, has a special sympathy and understanding of the worshippers of the Drow Gods.;;;;;;;;;;;x
sympathy_dwarven_pantheon_group;Sympathy for Dwarven Gods worshippers;;;;;;;;;;;x
sympathy_dwarven_pantheon_group_desc;This character, though not of a Dwarven faith, has a special sympathy and understanding of the worshippers of the Dwarven Gods.;;;;;;;;;;;x
sympathy_giant_pantheon_group;Sympathy for Giant worshippers;;;;;;;;;;;x
sympathy_giant_pantheon_group_desc;This character, though not of a Giant faith, has a special sympathy and understanding of the worshippers of the Giant Gods.;;;;;;;;;;;x
sympathy_draconic_group;Sympathy for Draconic worshippers;;;;;;;;;;;x
sympathy_draconic_group_desc;This character, though not of a Draconic faith, has a special sympathy and understanding of the worshippers of the Draconic Gods.;;;;;;;;;;;x
sympathy_many;Sympathy for Many Faiths;;;;;;;;;;;x
sympathy_many_desc;This character does not discriminate against others for their religious beliefs, provided they do not worship evil or monstrous deities.;;;;;;;;;;;x
chosen_reason;I am a §YChosen§!!;;;;;;;;;;;x
opposing_religious_alignment_reason;Opposing religious alignment;;;;;;;;;;;x
resilient_worshipper_reason;Resilient worshipper;;;;;;;;;;;x
decision_opinion_reason;Opinion;;;;;;;;;;;x
sympathy_for_good_alignment_reason;Sympathy for Good Alignment;;;;;;;;;;;x
sympathy_for_evil_alignment_reason;Sympathy for Evil Alignment;;;;;;;;;;;x
same_culture_reason;Same §YCulture§!;;;;;;;;;;;x
different_culture_reason;Different §YCulture§!;;;;;;;;;;;x
liege_diplomacy_reason;[Root.Liege.GetTitledFirstName]'s §YPersonal Diplomacy§!;;;;;;;;;;;x
opinion_of_liege_reason;[Root.GetTitledFirstName]'s §YOpinion§! of [From.GetTitledFirstName];;;;;;;;;;;x
foe_reason;[Root.GetTitledFirstName] is [From.GetTitledFirstName]'s §YFoe§!;;;;;;;;;;;x
infernal_beauty;Infernal Beauty;;;;;;;;;;;x
infernal_beauty_desc;Rumour has it that the source of this character's beauty is an infernal contract.;;;;;;;;;;;x
infernal_wit;Infernal Wit;;;;;;;;;;;x
infernal_wit_desc;Rumour has it that the source of this character's genius is an infernal contract.;;;;;;;;;;;x
infernal_strength;Infernal Strength;;;;;;;;;;;x
infernal_strength_desc;Rumour has it that the source of this character's strength is an infernal contract.;;;;;;;;;;;x
infernal_contractee;Infernal Contractee;;;;;;;;;;;x
infernal_contractee_desc;Rumour has it that this character is bound by an infernal contract, willingly or otherwise.;;;;;;;;;;;x
